title,text,category,source,url,date
Starmer is at his best right now – but he must accept there is no going back with Trump’s US | Martin Kettle,"The president has just four years until a successor takes the reins, but the new approach he has forged  exceptionalist, isolationist  is likely to endure Keir Starmer, it turns out, is at his best in a crisis. He has faced two since he became prime minister last year, one domestic, the other international. The first came with the riots that followed the Southport killings, when Starmers response was impressive and effective. The second is Donald Trumps attempt to stitch up Ukraine, where Starmer has been surefooted in trying to hold the line against a sellout to Russia. In both cases, he has looked like the right person in the right place at the right time. There was another example of this deftness on Wednesday in the Commons, when Starmer went out of his way to mark the anniversaries of the deaths of UK service personnel in 2007 and 2012. A total of 642 died in the Afghanistan and Iraq wars alongside their US allies. They would not be forgotten, he said. The name of JD Vance was not mentioned. Nor was the US vice-presidents contemptuous some random country insult this week. But Starmers reprimand was unerring. It is far too soon to say whether Starmers response to Trumps embrace of Russia and to the US administrations denunciations of Europe will be effective in the long run. What can be said is that, in public and private, the prime minister has so far led with tact and clarity and has scored one or two apparent successes against the run of play. Nevertheless, these are very early days. Trump boasted to Congress on Tuesday night that he was just getting started. Starmers ability in a crisis is an unexpected contrast with his leadership in the ordinary business of politics. Since July 2024, Starmers calm, methodical, long-game approach has succeeded only in squandering much of Labours election-winning goodwill, and in making him seem out of his political depth. But his deployment of these same unflashy tactics at moments of acute crisis, as in the case of Ukraine, could be gold dust. It has at least given the prime ministers ratings a boost. There are echoes here of the rallying around Boris Johnson at the start of Covid. But remember where that ended up. It is useful to note that this low-key approach marks a notable break. Throughout the postwar period, British leaders faced with international crisis modelled themselves on Winston Churchill in 1940. Margaret Thatcher saw herself this way during the Falklands war. Tony Blair echoed it after 911 and over Iraq. Johnson pretended he was Churchill when Russia invaded Ukraine. Starmers calm approach evokes Clement Attlee more than Churchill. In every way he is unTrump. Yet Starmer has not got much to be calm about. The world of 2024 no longer exists. Trump has triggered a crisis in the North Atlantic alliance. At stake are two epochal things. First, whether Russias main western border will henceforward be with Ukraine, with Poland or with Germany. Second, whether the US accepts any role in ensurin...",Politics,www.theguardian.com,https://www.theguardian.com/commentisfree/2025/mar/06/keir-starmer-donald-trump-foreign-policy-politics,2025-03-08
‘Trump said he’d have our backs’: Starmer’s magical assertions comfort Badenoch | Zoe Williams,"The government and opposition seem to have parked their rancour like divorcees at a parents evening Prime ministers question time existed, on this ordinary-looking spring day, to answer one monumental question that nobody in the chamber had even asked: are we, as the unsettlingly thuggish US vice-president, JD Vance, has said, some random country that has not fought a war in 30 or 40 years? Keir Starmers opening statement, in which he soberly read out the names and ages of men who fought for their country, for our country, crescendoing: Across the wars in Afghanistan and Iraq, 642 individuals died fighting for Britain alongside our allies, was arguably his direct and quite lawyerly response. We may be random, chum, but weve definitely fought in a bunch of wars, which  wait, let me check my notes  you started. Kemi Badenochs approach needs a bit of background. Shed been asked about our randomness by a reporter the day before, when she was on the farmers march, with Victoria Atkins standing behind her puzzlingly dressed in a union flag jacket, like Geri Halliwell trying to get into a golf club. Put a pin in that, because it will come up again later. Well, I know JD Vance quite well, Badenoch said. Ive looked at the comments, I dont think he actually said that. A lot of people are getting carried away, theyre saying loads of things. The unfortunate thing is, he did say that; if you wanted to deny it, your best possible bet would be he didnt mean us, he meant France, which wouldnt be very comradely. The opposition leaders course, to deny a thing we saw and heard, then cover it in the meaningless mouth-noises of a lot of people saying loads of things, looks like dimwittery but is actually systematically corroding observable reality. But never mind, in the Commons she took a new tack: a series of statements with which no reasonable person could disagree. She joined the prime minister in gratitude for our troops, and asked him to join her in hoping we wouldnt end up in a war against Russia. Thats the last thing anybody wants to see, Starmer agreed, and I dont want to say its the weirdest exchange thats ever happened in PMQs, but its certainly a new way to use time, agreeing that nobody wants that thing nobody wants. The surest risk is if Putin feels that he can breach a deal, Starmer continued, as if he was just one big thought away from the killer clause, that he could insert into a deal and make it watertight, and this satisfied Badenoch, who went on to be satisfied by a bunch of other optimistic, bordering on magical, assertions. Could the prime minister update the house on the steps he is taking to persuade America its in their national interest to provide a security guarantee? Sure he can: Trump already made it absolutely clear, in Washington, that he would have our backs, and Starmer has spoken to him three times since on the phone. Were into teenagers-whove-been-on-a-date territory. When he said hed call but immediately before that said he was go...",Politics,www.theguardian.com,https://www.theguardian.com/politics/2025/mar/05/trump-said-hed-have-our-backs-starmers-magical-assertions-comfort-badenoch,2025-03-08
‘Nigel Farage feels real’: why young British men are drawn to Reform,"Once, anti-establishment youth disillusioned with mainstream politics headed left. Now increasing numbers are tilting right. Why? Josh is 24 years old and works as a carer. Its not easy work, but he prefers it to his old job in a supermarket: most of his clients are elderly and just want someone there with them, because theyre lonely. In his spare time Josh used to be into boxing. But lately hes got into politics instead. Like many of his gen Z contemporaries, hes thoroughly disillusioned with the mainstream kind. The two parties that have been in power for 100-plus years have done nothing. The economys a mess, he scoffs. But if he sounds like the kind of anti-establishment young person who once rallied to the radical left, Joshs frustration has taken him in another direction. An ardent leaver in his teens, who backed Boris Johnson in 2019, he now belongs to Nigel Farages Reform UK. We meet in the packed bar of the Athena theatre in Leicester, alongside about 900 people who have paid 15 and dodged a noisy counterprotest to see their hero in the flesh at Reforms East Midlands rally. Their reward is nearly three hours of speakers attacking small boat crossings, woke ideology and grooming gangs raping and trafficking young girls. If you dont want to respect our history, our heritage, our way of life, our laws, then clear off, barks Reform MP Lee Anderson, as burly men ferry pints from the bar. Andrea Jenkyns, the ex-Tory MP who defected to Reform, says her seven-year-old wants to join, and implores parents to sign their adult children up. Throughout the night, someone keeps heckling Listen to Tommy Robinson! (the jailed far-right thug Stephen Yaxley-Lennon, whom Farage has consistently frozen out). Speeches are high on energy and emotion, switching in tone from end-of-the-pier-show jokes to rabble-rousing: by the time Farage himself begins glad-handing his way through the crowd, the adrenaline is pumping. Pyrotechnics explode at his feet and the bass is turned up chest-poundingly high. Like Donald Trump, hes learned to dish up politics as entertainment. What attracted Josh, he explains, is that Reform have never been in power, so they havent been tried and seen to fail. But he also thinks theyre the only party standing up for British values, criticising what he sees as mainstream parties attitude to British history and tradition. He didnt go to university, but seems suspicious of what might have happened there: There need to be more safeguards to stop lecturers from putting their own worldview on to students. Josh is articulate, polite and unusually formally dressed for his age, in suit and tie: hes interested in becoming an MP. But hes perhaps less confident than he sounds. Im quite an introverted person, he concedes. When I ask what his friends think about Reform, Josh says hes hovered around a few friendship circles lately. Most of his mates are either leftwing or not interested, but hes found a new community on TikTok. Josh flips open his iPad t...",Politics,www.theguardian.com,https://www.theguardian.com/politics/2025/mar/08/nigel-farage-feels-real-why-young-british-men-are-drawn-to-reform,2025-03-08
The Ukraine crisis has accelerated a reset of UK-EU relations – but will it last?,"Trumps abandonment of Ukraine has led even Farage to praise Starmers lead role in European diplomacy Barely a day passes, it seems, without Keir Starmer talking to another European leader or preparing for a continental summit. The crisis over Ukraine has very much pushed the UK closer towards the centre stage than at any point since Brexit. But is this a new era or a false dawn? One thing is certain: the optics of engagement have changed. Starmer never shared Boris Johnsons almost active pride in stoking a row with Brussels, but particularly before the election his advisers were wary of reminding voters about his past as a diehard remainer. With support for Ukraine about as close as the UK gets to an all-party consensus, things are very different. Starmer can be photographed at the very centre of a gathering of mainly European leaders, as he was on Sunday, safe in the knowledge that even Nigel Farage will praise him for his diplomacy. Donald Trumps apparent abandonment of Ukraine and reversal away from decades of Nato defence guarantees has really accelerated the rapprochement between Britain and Europe, not just the EU, said Peter Ricketts, the former senior UK diplomat and government national security adviser, who is now a crossbench peer. All the reports Ive heard from European friends in Brussels and Paris and elsewhere are that they are impressed and pleased with the Sunday meeting, and the sense that Britain is back in its natural place as a leader in European security, he said. It has taken the crisis, in a way, to really galvanise the improving relations that were already under way. This is happening amid what could be seen as a wider political shift. Polls about Brexit increasingly show that many voters view it as a mistake, and while there is arguably minimal appetite to revisit an issue that crippled UK politics for several years, trade unions are now pushing for closer EU ties. So could the necessities of supporting Ukraine help smooth the way for a close EU-UK relationship on trade? Lord Ricketts said he would be surprised if any of these Brussels red lines were suddenly blurred. I would draw a distinction between defence issues and the treaty-based issues about trade, fishing and energy markets and so on, which are all rooted in EU texts or EU-UK legal texts, which are going to be slower to change, he said. I think even with a crisis in Europe, in those sorts of areas its going to be slow going. Ukraine is to an extent a distinct issue. Defence links are often separated from Brussels, while the still-emerging coalition of the willing to fill the security vacuum covers some non-EU European states such as Norway, as well as Canada and potentially Australia. The defence and foreign policy wonks were already comfortable with a closer relationship with the UK, said Ian Bond, another former UK diplomat, who is deputy director of the Centre for European Reform thinktank. The problem is what happens in other parts. He added: The thing will ...",Politics,www.theguardian.com,https://www.theguardian.com/politics/2025/mar/07/ukraine-crisis-reset-uk-eu-relations-diplomacy-trump,2025-03-08
"‘I have a pathological need to be right’: Ash Sarkar on culture wars, controversy and Corbyn’s lost legacy","Shes been described as divisive by the left and the Queen of woke by the right, but does the journalists new book really signal a change in her entire belief system? Youre not going to believe me when I say this: Im a conflict-averse person, says Ash Sarkar. Shes laughing as she says it. Even if I did believe her, a lot of people wouldnt. Over the past decade, Sarkar has built a reputation for bringing the fight, robustly defending her positions, and generally putting herself in the line of fire  on television panel discussions, on social media and in her journalism (for this paper and as a contributing editor at Novara Media, among others). Even her detractors would admit shes very good at it, cutting through the politicians earnest bluster and articulating whats on ordinary peoples minds  none of which has endeared her to the rightwing. Now Sarkar has annoyed the leftwing as well. In her new book Minority Rule, she contends that embracing identity politics and culture wars has not always served the working class well. By making a virtue of marginalisation, breaking ourselves down into ever smaller and mutually hostile groupings, we make it impossible to build a mass movement capable of taking on extreme concentrations of wealth and power, she writes. Policing language and embracing concepts such as lived experience and white privilege has discouraged solidarity and alienated would-be allies. If she was looking to avoid conflict, this is a curious way to go about it. Such sentiments could be seen as throwing her allies under the bus and giving her opponents plenty of ammunition, hence the recent Daily Telegraph headline The Queen of woke just exposed the hypocrisy of the virtue-signalling left. The implication is that Sarkar adopted identity politics when it suited her in the past, but is now reversing her position. Sarkar doesnt see it like that. There are obviously things that Ive shifted on, she says when we meet. I definitely had that phase in my early 20s of being, like, she points around the room White privilege, white privilege, white privilege. You could point at a floor lamp and be like, Neo-colonial ideology. In part thats to do with being an arts and humanities graduate, where you are trained to look at everything as language and narrative and discourse  but this idea that I was somebody who was advancing a narrative around hypersensitivity and saying its a good thing, I dont think really fits the facts. What she is arguing for is less a 180-degree pivot than a return to first principles. I see it as a way to reflect on the last 15-odd years and say: What happens if I try to look at this through a rigorously materialist lens? So that doesnt mean throwing away anti-racism or pretending that everybody has the same experience of society but looking at the economic forces in society, the way in which politics is mediated through institutions of legacy media, social media, and saying: Where does that get me? Understandably, the woke is dea...",Politics,www.theguardian.com,https://www.theguardian.com/politics/2025/mar/07/i-have-a-pathological-need-to-be-right-ash-sarkar-on-culture-wars-controversy-and-corbyns-lost-legacy,2025-03-08
"American severance may be averted, but Europe’s leaders must fear the worst","Head-spinning speed of events leaves EU adapting at pace while trying to infer Trumps possible geo-strategic aims With a mixture of regret, laced with incredulity, European leaders gathered in Brussels to marshal their forces for a power struggle not with Russia, but with the US. Even now, of course at the 11th hour, most of Europe hopes this coming battle of wills can be averted and the Trump administration can still be persuaded that forcing Ukraine to the negotiating table, disarmed and blinded, will not be the USs long-term strategic interest. It has fallen to John Healey, the UK defence secretary; and Tony Radakin, the chief of the defence staff, meeting their opposite numbers in Washington to see if there are any conditions in which the US will provide the backstop Europe insists it needs to send a reassurance force into Ukraine to protect a ceasefire. One European diplomat said: We will know very soon if the US has set its face against helping Europe, and what its explanation is. As the French president, Emmanuel Macron, put it in his patriotic address on Wednesday night: I want to believe that the United States will remain at our side. But we must be ready if that is not the case. In saying this, he caught the spirit of the Brussels summit, and the new mood in Germany being led by the chancellor-elect, Friedrich Merz. It is, so far as relations with Washington are concerned, a mood of optimism of the will combined with pessimism of the intellect. It requires Europe to prepare for a severance with the US, and one that may come much sooner than Nato planners had envisaged. Specifically, it requires European nations to upend their economies and throw out their fiscal debt rules that once seemed immutable, even if it risks a confrontation with the bond markets as well as part of their electorates. Whatever it takes, the slogan coined by Mario Draghi, the former head of the European Central Bank, to get Europe through the eurozone crisis, is being revived to get Europe through this security crisis. But in a sense, diplomats say, as with the eurozone crisis this is not just about money, or even transferring resources to spend more on defence over the next four years, critical as this will be. This is about political will, and taking the mental leap of independence from America. One western diplomat said: Macron was probably right in his talk of European strategic autonomy. We have wasted seven years not building a European defence capability, and now we must make up for lost time. The first stage is to put Donald Trump on the back foot by showing that Ukraine is not the war party, as claimed by the US vice-president, JD Vance. Kyivs proposal for an immediate pause in the fighting covering sea, air and energy installations is backed by Macron and the British prime minister, Keir Starmer. The aim is to flush Vladimir Putin out and try to show the White House that the obstruction to a ceasefire and a just deal lies in Moscow and not Ukraine. One E...",Politics,www.theguardian.com,https://www.theguardian.com/world/2025/mar/06/american-severance-may-be-averted-but-europes-leaders-must-fear-the-worst,2025-03-08
Tesco trials giant trolley scales in Gateshead,"Giant trolley scales are being trialled at a Tesco store in Gateshead sparking a mixed reaction from shoppers. Trolleys are weighed before checkout to identify any items customers who have used Scan as you Shop might have missed or scanned twice. But some shoppers are unsure whether the new technology will take off with some likening it to airport security. Am I at border control or Tesco? one Reddit user posted, while another joked No clubcard? Deported! Others questioned whether the scales were aimed at cracking down on self-scan shoplifters or cutting back on checkout staff. Tesco declined to comment. Tesco Clubcard members already have the option to use Scan as you Shop handsets as they fill their trolleys then check out and pay at the end. Now in the Gateshead Trinity Square Extra store, shoppers can push their trolley on to the scales and if the weight matches the items theyve scanned they pay as normal. If there is a discrepancy a staff member will do a manual rescan of the whole trolley. Although some Reddit users who commented on the photo of the scales were positive with one saying they are 10x more convenient and faster, many were more critical of their introduction. More and more the honest shopper is treated like a thief, one said, while another wrote the point of all this is to save on staff. Business retail consultant Ged Futter told the BBC this was about loss prevention and staffing costs. There is no way this is about making it quicker for the shopper. Its supposed to be scan and go - this is scan and stop while your trolley is weighed. He said self-scan had increased the rate of shoplifting but instead of putting staff back on tills, supermarkets were trying to use even more technology to stop thefts. This is supermarkets saying, we know there are thefts so what we are going to do is treat every customer in exactly the same way to reduce theft. Theyre forgetting that trust is the most important thing for all of the retailers and it works both ways. If customers dont feel trusted or think theyre being treated like thieves they will go somewhere else. The British Retail Consortium has said shoplifting is out of control after its annual crime survey found incidents of customer theft reported by retailers in the UK rose by 3.7 million to 20.4 million, and cost retailers 2bn. Separate figures published by the Office for National Statistics revealed shoplifting offences reported by police in England and Wales rose by 23 to more than 492,000 over the same period. That is the highest figure since current recording practices began in 2003. Retail criminologist Prof Emmeline Taylor told the BBC she had seen similar trolley scales used in European supermarkets and there was definitely an element of trying to control loss but added lets not forget a lot of scan and go loss can be accidental. A random audit of 20,000 scan and go baskets found 43 had at least one error, a 2022 global study on self-checkout found. Prof Taylor said Tescos scal...",Business,feeds.bbci.co.uk,https://www.bbc.com/news/articles/c0rzvrjkklko,2025-03-08
"Data, waves and wind to be counted in the economy","Wind and wave are set to be included in calculations of the size of countries economies for the first time, as part of changes approved at the United Nations. Assets like oilfields were already factored in under the rules - last updated in 2008. This update aims to capture areas that have grown since then, such as the cost of using up natural resources and the value of data. The changes come into force in 2030, and could mean an increase in estimates of the size of the UK economy making promises to spend a fixed share of the economy on defence or aid more expensive. The economic value of wind and waves can be estimated from the price of all the energy that can be generated from the turbines in a country. The update also treats data as an asset in its own right on top of the assets that house it like servers and cables. Governments use a common rule book for measuring the size of their economies and how they grow over time. These changes to the rule book are tweaks, rather than a rewrite, according to Prof Diane Coyle of the University of Cambridge. Ben Zaranko of the Institute for Fiscal Studies (IFS) calls it an accounting change, rather than a real change. He explains: Wed be no better off in a material sense, and tax revenues would be no higher. But it could make economies look bigger, creating a possible future spending headache for the UK government. For example, Labour has committed to allocating fixed percentages of the size of the economy on defence and aid. If the new rules increase the estimated size of the economy by 2-3 in 2030, it might add 2bn to defence spending. That is a tiny share of the total government budget, but large compared with the cuts to overseas aid (6bn) that are currently funding extra defence spending or the headroom that the government has left to meet its self-imposed fiscal rules (10bn). The government spending watchdog, the Office for Budget Responsibility (OBR), will not be including the impact of these new rules on the government finances in their assessment of the government finances this March. This makes the new rules a possible future headache for the Chancellor rather than an immediate one. What do you want BBC Verify to investigate?",Business,feeds.bbci.co.uk,https://www.bbc.com/news/articles/czedpnen168o,2025-03-08
