title,text,category,source,url,date
"Help! I Couldn’t Take My Tall-Ship Voyage, and I Want My Money Back.","Last summer, I booked a five-day sailing trip with Tall Ship Experience, a company based in Spain. For 1,350 euros, or 1,450, I would be a volunteer on the crew of the Atlantis, sailing between two ports in Italy. But eight days before, I had a bad fall that resulted in multiple injuries, including eight stitches to my face that doctors said I could not expose to sun or water. The Tall Ship Experience website clearly states that I could cancel for a full refund up to seven days before the trip. But the company revealed it was just an intermediary and the Dutch organization actually running the trip, Tallship Company, had different rules, under which I was refunded 10 percent. I offered to take credit for a future trip, to no avail. Finally, I disputed the charges with my credit card issuer, American Express. But Tall Ship Experience provided a completely different set of terms to Amex, saying I canceled one day in advance. The charges were reinstated. Can you help? Martha, Los Angeles This story reads like a greatest-hits playlist of travel industry traps: a middleman shirking responsibility, terms and conditions run amok, a credit card chargeback gone wrong, and the maddening barriers to pursuing justice against a foreign company. However, the documentation you sent was so complete and the companys website so confusing that I was sure Tall Ship Experience would quickly refund you. Tallship Company did not respond to requests for comments, but did nothing wrong. It simply followed its own terms and conditions that Tall Ship Experience, as a middleman, should have made clear to you. When you canceled, Tallship Company sent back a 10 percent refund to Tall Ship Experience to then send to you. Thats why I was surprised that the stubborn (though exceedingly polite) Tall Ship Experience spokeswoman who responded to me on behalf of the Seville-based organization argued repeatedly that although she regretted your disappointment, Tall Ship Experience was not at fault. At one point she suggested you should have purchased travel insurance, even as the company scrambled to adjust and update its website as we emailed. Before the changes, the site contained two distinct and contradictory sets of terms and conditions: one for customers who purchased via the websites English and French versions, and another on the Spanish version. (Confusingly, both documents were in Spanish.) The EnglishFrench version  the one you had seen  promised customers a full refund for trips canceled more than seven days in advance. The Spanish one is vastly more complex, offering distinct cancellation terms for each ship. The Atlantis offered customers in your situation only 10 percent back. We are having trouble retrieving the article content. Please enable JavaScript in your browser settings. Thank you for your patience while we verify access. If you are in Reader mode please exit and log into your Times account, or subscribe for all of The Times. Thank you for your patience while w...",Business,rss.nytimes.com,https://www.nytimes.com/2025/03/06/travel/tall-ships-spain-customer-service.html,2025-03-08
"To Create Opportunities for Other Women, Odessa Jenkins Formed Her Own League","This article is part of a Women and Leadership special report highlighting women who are charting new pathways and fighting for opportunities for women and others. In the football world, those who know Odessa Jenkins would say that shes got fire, spunk and the ability to turn things up a notch. Its an apt description for Ms. Jenkins, a native of what was then known as South-Central Los Angeles, who has distinguished herself in the world of female tackle football as a Womens Football Hall of Fame running back, holder of eight world titles and three gold medals from various sports entities, and as head coach for the Texas Elite Spartans. Ms. Jenkins, 44, who now resides in Dallas, was deeply frustrated with the lack of diversity in the male-dominated field of football. Though she found some avenues to play, she was painfully aware that there were not many such opportunities for other women  and those that did exist were not profit-generating and didnt offer economic stability. In 2019 she founded the Womens National Football Conference, W.N.F.C., a for-profit, full-contact womens professional football league whose mission is to foster financial equity for women and girls through the power of football. I wanted women to be recognized as professional football players and to be paid for it, she said. I didnt want to wait another 60 years for that to happen. The league started out with 15 teams across the United States, including the Texas Elite Spartans. Since then, the league has gained three teams. We are having trouble retrieving the article content. Please enable JavaScript in your browser settings. Thank you for your patience while we verify access. If you are in Reader mode please exit and log into your Times account, or subscribe for all of The Times. Thank you for your patience while we verify access. Already a subscriber? Log in. Want all of The Times? Subscribe.",Business,rss.nytimes.com,https://www.nytimes.com/2025/03/06/business/women-power-football-odessa-jenkins.html,2025-03-08
A Youth Leader From Chile Fights Discrimination Across the Globe,"This article is part of a Women and Leadership special report highlighting women who are charting new pathways and fighting for opportunities for women and others. The first time she encountered discrimination, Isidora Uribe Silva said, she was 12. Up until that point, having cerebral palsy was never a problem from the perspective of others, but when I changed schools, I was bullied by my classmates, said Ms. Uribe Silva, who relies on a walker or cane to get around. My teachers and the school wouldnt accommodate me, and I was increasingly isolated. Ms. Uribe Silva (whose birth name was Isidora Guzmán Silva) said that she ended up leaving and didnt attend school at all for seven months until she found Institución Teresiana in Santiago, Chile, where she still lives, which was willing to accept her with her disability. This experience made me deeply aware of the systemic exclusion that exists, not just for myself but for many other marginalized communities worldwide, said Ms. Uribe Silva, now 20 and a law student at the Pontifical Catholic University of Chile. She became an advocate for inclusion policies, working to promote equality in Chile and globally, especially for women like her who have disabilities. Ms. Uribe Silva was 13 when she developed an app, Encuentra Tu Lugar (Find Your Place), to help disabled people in Chile find accessible parking spaces. Subsequently, she established a foundation of the same name and broadened her goals. She is a member of the Generation Equality Adolescent Committee of U.N. Women and was selected to be part of the U.N. Women Leaders Network, established during the U.N. General Assemblys annual session in September; the group advocates for gender-equal participation in leadership and in decision-making processes. Ms. Uribe Silva was interviewed by phone and email. The conversations were edited and condensed. We are having trouble retrieving the article content. Please enable JavaScript in your browser settings. Thank you for your patience while we verify access. If you are in Reader mode please exit and log into your Times account, or subscribe for all of The Times. Thank you for your patience while we verify access. Already a subscriber? Log in. Want all of The Times? Subscribe.",Business,rss.nytimes.com,https://www.nytimes.com/2025/03/06/world/americas/women-chile-inclusion-disabled.html,2025-03-08
7-Eleven Taps American Executive to Help Keep It Out of Canadian Hands,"Fighting off a takeover by a Canadian rival, the Japanese parent company of 7-Eleven announced a major business shake-up on Thursday that included the appointment of its first foreign-born chief executive. Seven  i Holdings said that Stephen Dacus, 64, a member of the companys board of directors and longtime retail executive from the United States, would take on the role in May. It also said it planned to hold an initial public offering of its U.S. convenience store business, which operates more than 13,000 7-Eleven branches in the country. The moves are the companys latest attempt to prevent itself from being acquired by the retail group Alimentation Couche-Tard, the Canadian owner of the Circle K convenience store chain. That company has offered about 47 billion for control of Seven  i, the largest-ever foreign-led bid for a Japanese company. Japans corporate landscape, which in many ways resisted change for decades, is beginning to shift in the face of an influx of attention from foreign investors. The reshuffling at Seven  i, whose convenience stores are so ubiquitous in Japan that they are considered part of the national infrastructure, is the latest example of that transformation. Activist investors have long pushed Seven  i to spin off its 7-Eleven convenience store business, arguing that doing so would improve the valuation of the sprawling retail group, whose businesses ranged from supermarkets to outlets that sold things like stationery and baby goods. We are having trouble retrieving the article content. Please enable JavaScript in your browser settings. Thank you for your patience while we verify access. If you are in Reader mode please exit and log into your Times account, or subscribe for all of The Times. Thank you for your patience while we verify access. Already a subscriber? Log in. Want all of The Times? Subscribe.",Business,rss.nytimes.com,https://www.nytimes.com/2025/03/06/business/7-eleven-stephen-dacus.html,2025-03-08
More Than 36 Million Watched Trump’s Address to Congress on Live TV,"About 36.6 million Americans watched President Trump live on television on Tuesday night, tuning in for his 100-minute speech to a joint session of Congress  the longest of its kind in the modern era. Nielsen, the ratings agency, said the live television audience for Mr. Trumps wide-ranging and often pugilistic address was up 13 percent from former President Joseph R. Biden Jr.s final State of the Union speech a year ago. The annual presidential speech to Congress is one of the last remaining mass-audience media moments available to a national politician. Mr. Trump, a connoisseur of television and a former star of reality TV, moved to take advantage of the large audience, repeatedly taunting the Democrats in the chamber and boasting of a new golden age in the country. Nielsen ratings mostly measure traditional television viewers, leaving out millions of Americans who often follow major news events across a plethora of news websites and some other digital platforms. While Mr. Trumps speech clocked in at record-breaking length, many voters were likely to consume shorter clips of isolated moments circulated on social media and cable news. The Nielsen ratings figure for Tuesdays speech spanned 15 major cable and broadcast networks. The industry has no widely agreed-upon metric to accurately measure online and digital-only views. Fox News, which has extended its ratings dominance in recent months, attracted the largest TV audience of any network on Tuesday, with 10.7 million viewers, according to Nielsen. Among other cable news networks, CNN and MSNBC both drew about 1.9 million viewers. The highest-rated broadcast network was ABC, which attracted about 6.3 million viewers. It was also the top-ranked broadcast network among viewers ages 25 to 54, which is considered the most important demographic for the advertisers in television news. According to Nielsen, about 71 percent of live TV viewers were 55 and older.",Business,rss.nytimes.com,https://www.nytimes.com/2025/03/05/business/media/trump-speech-ratings.html,2025-03-08
L.A. County Sues Southern California Edison over Eaton Fire,"Los Angeles County sued Southern California Edison and its parent company on Wednesday, blaming the utilitys equipment for causing the deadly Eaton fire in January. The countys lawsuit is the most prominent case brought against Edison, which is also facing scores of lawsuits filed by victims of the fire that killed 17 people and destroyed more than 9,400 buildings near Altadena and Pasadena, Calif. The cities of Pasadena and Sierra Madre are also filing suits against Edison for damages that include the use of taxpayer resources and destruction of public infrastructure during the fire, the county said. We are committed to seeking justice for the Altadena community and the taxpayers of Los Angeles County, Dawyn R. Harrison, counsel for Los Angeles County, said in a statement. The official cause of the Eaton fire remains under investigation by the State Department of Forestry and Fire Protection. An Edison spokeswoman, Kathleen Dunleavy, said the utility had been reviewing the lawsuits and would respond to the complaints in court. Our hearts continue to be with the communities affected by the wildfires, Ms. Dunleavy said. In its lawsuit, Los Angeles County said videos, eyewitness accounts and other evidence made clear that Edison equipment caused the Eaton fire on Jan. 7. Preliminary reviews by fire investigators placed the origin of the fire in Eaton Canyon, where Edison maintains four active and three inactive transmission lines. A gas station video that appeared to show the beginnings of the fire and data that suggest there were electrical faults on Edisons transmission system, both of which were first reported by The New York Times, prompted the utility to expand its own investigation into the cause of the fire. In a letter to state regulators, the utility said it was examining the available evidence and equipment to determine if its equipment might have been involved in starting the fire. Edison also noted in the letter that there might be a connection between its equipment and another fire that started the same day, the Hurst fire in Sylmar. The Eaton and Hurst fires were among several blazes that burned across the Los Angeles area in January as a storm ripped through Southern California with winds reaching as high as 100 m.p.h. In addition to the Eaton fire, 12 people died in the Palisades fire, which devastated the coastal neighborhood of Pacific Palisades. The Palisades fire also remains under investigation.",Business,rss.nytimes.com,https://www.nytimes.com/2025/03/05/business/energy-environment/la-county-eaton-fire-edison-lawsuit.html,2025-03-08
South Africa’s Play to Ease Tensions With Trump: A New Trade Deal,"South Africa is preparing a new trade offer to present to President Trump, hoping to appeal to his transactional approach to foreign policy and ease boiling tensions with Washington, a spokesman for South Africas president said this week. The spokesman, Vincent Magwenya, said in an interview that South African officials are anticipating Mr. Trump will call for an end to the African Growth and Opportunity Act, a decades-old trade agreement that has been an economic boon to the 32 African nations that it includes. The act allows billions of dollars worth of goods  from produce to cars  from sub-Saharan Africa to enter the United States without duties. It is scheduled to expire this year but could be reauthorized by Congress. Although officials in South Africa hope the program will be renewed, they plan to offer the United States a bilateral deal that would increase trade in sectors such as energy, Mr. Magwenya said. A future without the African Growth and Opportunity Act would represent a significant shift for the continents largest economy. South Africa has for years lobbied against threats to expel it from the program on the grounds that its economy had grown too advanced. South African officials argue that the African Growth and Opportunity Act has kept businesses confident in the South African economy, helped maintain stability across the continent and fostered a healthy relationship with the United States. We are having trouble retrieving the article content. Please enable JavaScript in your browser settings. Thank you for your patience while we verify access. If you are in Reader mode please exit and log into your Times account, or subscribe for all of The Times. Thank you for your patience while we verify access. Already a subscriber? Log in. Want all of The Times? Subscribe.",Business,rss.nytimes.com,https://www.nytimes.com/2025/03/05/world/africa/south-africa-trump-trade.html,2025-03-08
Tom Llamas Named Anchor of ‘NBC Nightly News’,"Tom Llamas will take over as the anchor of NBCs flagship news program, NBC Nightly News, the company said on Wednesday. Mr. Llamas, 45, has been the anchor on the companys streaming news outlet, NBC News Now. He succeeds Lester Holt, the longtime anchor of NBC Nightly News, who last month announced his plans to step down from the role. The network said Mr. Llamas would take over NBC Nightly News this summer, assuming a lead anchor job that has been held by only three men  Tom Brokaw, Brian Williams and Mr. Holt  over the past 42 years. Of course, the evening newscast does not have the same agenda-setting influence as it did during Mr. Brokaws tenure. But the newscasts still draw big audiences. Since September, NBC Nightly News has been attracting 6.3 million viewers a night, lagging ABCs World News Tonight but remaining ahead of CBS Evening News. In a statement, Mr. Llamas (pronounced YA-mas) said that taking over the anchoring duties was a profound honor and one that carries tremendous responsibility. During the Nightly News afternoon editorial call on Wednesday, Mr. Holt called in from an Amtrak en route to New York from Washington and offered his congratulations. Its important to make the broadcast his, and you will over time, so well make this transition work, he said, according to a staff member who heard his remarks. But Im happy, happy for Tom and his family  crush it my friend. We are having trouble retrieving the article content. Please enable JavaScript in your browser settings. Thank you for your patience while we verify access. If you are in Reader mode please exit and log into your Times account, or subscribe for all of The Times. Thank you for your patience while we verify access. Already a subscriber? Log in. Want all of The Times? Subscribe.",Business,rss.nytimes.com,https://www.nytimes.com/2025/03/05/business/media/tom-llamas-nbc-nightly-news.html,2025-03-08
Trump Says US Banks Can’t Do Business in Canada. It’s Not That Simple.,"Hours after imposing steep tariffs on Canada, President Trump raised an issue that even the American lenders whose cause hes championing find perplexing: the access, or lack thereof, of U.S. banks to the Canadian market. On Tuesday, Mr. Trump wrote in a post on Truth Social, Canada doesnt allow American Banks to do business in Canada, but their banks flood the American Market. He added sarcastically, Oh, that seems fair to me, doesnt it? While this issue doesnt often come up in conversations with prominent American bank executives, it appears to be increasingly on the presidents mind. Mr. Trump mentioned the Canada banking issue early last month as part of a broader criticism against what he views as the unequal economic balance between the United States and its northern neighbor. Writing on Truth Social, Mr. Trump said Canada doesnt even allow U.S. Banks to open or do business. Here is the actual state of play for U.S. banks in Canada: Canadas banking sector is dominated by the Big Six, the half-dozen institutions including the Royal Bank of Canada and TD Bank. They are permitted to take deposits, extend mortgages and advise corporate clients  all the core activities for banks. And Canadian customers disproportionately still prefer to do their banking in person, as opposed to online, meaning it would require a major physical presence for any entrant to attempt to enter the market. Additionally, U.S. banks are restricted in what they can do in Canada. Foreign banks, including American ones, must either work with a Canadian middleman, establish a Canadian subsidiary or receive special government permission to do business. Unless they agree to follow Canadas stringent banking rules that include holding a hefty sum of cash-like assets in reserve at all times, they cannot operate retail branches that take deposits under around 100,000. We are having trouble retrieving the article content. Please enable JavaScript in your browser settings. Thank you for your patience while we verify access. If you are in Reader mode please exit and log into your Times account, or subscribe for all of The Times. Thank you for your patience while we verify access. Already a subscriber? Log in. Want all of The Times? Subscribe.",Business,rss.nytimes.com,https://www.nytimes.com/2025/03/05/business/trump-canada-us-banks.html,2025-03-08
Weight Loss Drug Will Be Offered for $499 a Month for Some Patients,"Novo Nordisk will cut the price of its blockbuster weight loss medication Wegovy to 499 per month for certain patients who pay using their own money instead of going through insurance, the drug maker said on Wednesday. The move could cause more patients to start taking the drug. But the impact stands to be limited, because the decision does not lower prices for patients who get their health insurance through government programs or for employers that are struggling with the huge costs of medications like Wegovy, which have revolutionized the treatment of obesity. To be eligible for the reduced price, patients must be uninsured or commercially insured on plans that dont cover the drug. Previously, the drug maker had offered a coupon to such patients allowing them to get a months supply of the drug for 650; Wednesdays move translates into savings of 150 per month for such patients. The new offering is not available to tens of millions of Americans who get their insurance through government programs like Medicare and Medicaid  a demographic that largely lacks insurance coverage for weight loss drugs like Wegovy. To get Novo Nordisks drug, these patients must generally pay 1,300 or more per month out of pocket at a pharmacy. Novo Nordisk will offer the discounted product through an online pharmacy that will send prescriptions to patients through the mail  a strategy that drug makers are increasingly using to take more control of the distribution of their products. Novo Nordisks competitor, Eli Lilly, has a similar offering for vials of its weight loss drug, Zepbound, for 499 per month or less. Novo Nordisks price reduction comes just weeks before the market for cheaper copycat versions of Wegovy is expected to contract substantially. For the past few years, patients seeking lower prices have turned to versions created through a drug-ingredient mixing process known as compounding, which is permitted by regulators when patented products are in short supply. Patients often pay about 150 per month out of pocket for compounded versions of Wegovy. An estimated two million patients got the drug this way over a recent one-year period. But last month the Food and Drug Administration declared the Wegovy shortage over and ordered compounders to wind down their operations by April or May. Novo Nordisk now has the opportunity to scoop up displaced patients who had been relying on compounding and increase sales of its official version of the drug.",Business,rss.nytimes.com,https://www.nytimes.com/2025/03/05/health/wegovy-price-weight-loss-drugs.html,2025-03-08
"Hackers Stole $635,000 in Taylor Swift Ticket Scheme, Queens D.A. Says","Two people accused of stealing and reselling more than 900 tickets to the Taylor Swift Eras Tour and other marquee events are facing criminal charges for their role in the scheme, New York prosecutors said. Several people were involved in hacking into the computer system of the online ticket-sales platform StubHub starting in the summer of 2022, the Queens district attorney, Melinda Katz, said in a news release on Monday. They then resold the tickets on the same platform for a profit, which added up to 635,000. Tyrone Rose, 20, of Kingston, Jamaica, and Shamara P. Simmons, 31, of the New York City neighborhood of Jamaica, Queens, were arrested and arraigned on Feb. 27 in Criminal Court in Queens. The lawyers listed for them in court documents did not immediately respond to a request for comment. Mr. Rose and Ms. Simmons were both charged with second-degree grand larceny, first-degree computer tampering, fourth-degree conspiracy and fourth-degree computer tampering. Mr. Rose worked for an outsourcing company in Kingston, Sutherland Global Services, which was contracted by StubHub, according to the criminal complaint. Mr. Rose and a co-worker, who has not been arrested or publicly identified, used their access to part of StubHubs ticketing system to find a way into a secure part of the network that they were not authorized to use, where information about ticket orders was stored. We are having trouble retrieving the article content. Please enable JavaScript in your browser settings. Thank you for your patience while we verify access. If you are in Reader mode please exit and log into your Times account, or subscribe for all of The Times. Thank you for your patience while we verify access. Already a subscriber? Log in. Want all of The Times? Subscribe.",Business,rss.nytimes.com,https://www.nytimes.com/2025/03/05/business/taylor-swift-tickets-stolen-stubhub.html,2025-03-08
