title,text,category,source,url,date
UK death rate 'reaches record low',"The UK death rate reached a record low last year, according to exclusive analysis carried out for BBC News. Mortality experts looked at death certificates registered in 2024 and found that deaths per head of the population had returned to pre-pandemic levels and were slightly below the previous record in 2019. However, the new figure puts the UK back on its long-term trend of only gradual improvement. The research was carried out by analysts from the Continuous Mortality Investigation (CMI) at the Institute and Faculty of Actuaries. This is five years of basically flat mortality improvement, its pretty poor by historical standards, said Stuart McDonald from the CMI. There was also a concerning rise in the death rate at young working ages, he said. A Department of Health spokesperson said the government was shifting focus from sickness to prevention. The registered death rate in the UK steadily halved from 1974 to 2011 largely driven by improvements in tackling heart disease, including smoking prevention and medical advances. From 2011 to 2019 the improvements drastically slowed, then changed direction during Covid as thousands more people died than normal. The first post-pandemic year of 2022 also saw high numbers of extra deaths. To calculate the record low 2024 UK figure of 989 deaths per 100,000 people, analysts at the CMI used provisional weekly death registration figures for the four nations of the UK. Clearly, its very good news that our mortality rate is lower in 2024 than it was, says Dr Veena Raleigh, epidemiologist at health think tank The Kings Fund. But if you look at the broader canvas then its not so good. Although similar countries also experienced a slowdown since 2011, the UKs has been more severe and our life expectancy is at the bottom of the pack of comparable countries, she says, adding that nations such as Spain returned to pre-pandemic levels by 2023. Researchers point to a variety of reasons behind the slowdown since 2011. Some of the low hanging fruit of improvements in heart disease and cancer, such as the cut in smoking rates, had already happened, making further gains harder. At the same time, the UK saw rising risk factors, including obesity, poor diet and low levels of exercise, against a backdrop of widening social inequality and pressure on the NHS. Some academics argue that austerity cuts to public services after the 2008 financial crash had a strong impact on life expectancy, while others say its not possible to prove this directly. Dementia and Alzheimers disease is the leading cause of death in England and Wales, according to the latest official figures. Heart disease, lung disease, strokes, lung cancer also feature highly, along with flu in some years. Cardiovascular disease remains a leading killer in the UK, said Prof Bryan Williams OBE, chief scientific and medical officer at the British Heart Foundation. The plateau we have seen in reducing the number of deaths... is a serious cause for concern, made worse...",Health,feeds.bbci.co.uk,https://www.bbc.com/news/articles/c8j09vn2x2ko,2025-03-08
GPs strike deal to help end '8am scramble' for appointments,"Patients will be able to book more appointments online and request to see their usual doctor under a new contract agreed with Englands GPs, the government has said. The deal gives an extra 889m a year to general practices, as well as a reduction in red tape and targets that ministers hope will mean doctors are freed up to see more patients. The Labour government made manifesto promises to bring back family doctors and end the early morning phone scramble for appointments. The doctors union, the British Medical Association (BMA), says the deal is an important first step in restoring general practices. However, doctors also want the government to commit to talks about a completely new national contract for GPs within this parliament. GP surgeries are seen as the front door to the NHS but for years now, doctors have been warning about the pressure their service is under. Patients have felt it too, with some people facing long waits for appointments. Long waiting times for routine GP appointments have led to the now familiar 8am scramble for a same-day appointment. Many GP surgeries open their telephone lines at 8am, meaning that if you want an on-the-day appointment, you have to phone on the dot at 8am. It is a frequent source of complaints from patients who often find themselves held in long queues, only to be told all the appointments have been booked up. Not all surgeries work like this though, with others operating telephone call-back services or online triage so that patients can be prioritised. The new contract says patients should be able to arrange appointments online throughout working hours, freeing up the phones for those who need them most, and making it easier for practices to triage patients based on medical need. The new agreement for the next 2025-26 financial year will see the total value of the contract grow by 7.2. The total figure includes almost 800m to cover rising costs, such as staff wages, repairs and maintenance of buildings and more patients. Other measures include a greater flexibility for surgeries when it comes to employing different healthcare staff. GPs will get paid more to carry out routine childhood vaccinations. Through cutting what the government describes as box-ticking targets, ministers say GPs will be freed up to take the first steps towards ending the 8am scramble for an appointment. Health and Social Care Secretary Wes Streeting says that these are the first steps in fixing what he describes as a broken NHS. Over the past decade, funding for GPs has been cut relative to the rest of the NHS, while the number of targets for GPs has soared, he said. Thats why patients are struggling to get an appointment. This government is cutting the red tape that ties up GPs time and backing them with an extra 889m next year. In return, more patients will be able to request appointments online and see their regular doctor for each appointment. Dr Katie Bramall-Stainer, who chairs the BMA GPs committee, says this contract is...",Health,feeds.bbci.co.uk,https://www.bbc.com/news/articles/cd7ee895nr0o,2025-03-08
Cancer patients 'may starve' without vital drug,"Cancer patients and others with debilitating conditions have highlighted shortages of a vital drug they say have had a devastating impact on their lives. Creon, a pancreatic enzyme replacement therapy (Pert), helps digestion, but has been hard to obtain for the last year and shortages are predicted to last until 2026. It is thought more than 61,000 patients in the UK need it, including those with pancreatic cancer, cystic fibrosis and chronic pancreatitis. Some patients said through Your Voice, Your BBC News that they have had to cover long distances to find a pharmacist with supplies. The Department of Health and Social care says it is working closely with the NHS, manufacturers and others in the supply chain to try to resolve the issues. Without the drug, patients lose weight and strength, which means their ability to cope with treatment such as chemotherapy is reduced. Diana Gibb, who is 74, and her husband Mick, 78, live in Tonbridge, Kent. Mick had a major operation to treat pancreatic cancer in 2023. Diana wrote to BBC News explaining that it is impossible for Mick to digest food without creon. She says he was prescribed a high dose to enable him to regain weight after losing four stone in hospital, but it became increasingly difficult to get hold of the medicine. We started to have trouble getting them in the higher dosage, involving me traipsing round pharmacies to find one who could get them. Pharmacies cannot get hold of that dosage. He now has to take a lower dose doubling up on the number of tablets taken, one box now lasts less than a week. Pharmacies cannot get hold of lower dosage either and there is no alternative medication. I was worried that my husband would starve to death without them. Diana says for now they can get supplies of the drug but there is no guarantee week-to-week, and that is still a big worry. Bryony Thomas, who is from Stroud in Gloucestershire, needs creon after being diagnosed with pancreatic cancer. Her cancer is now in remission, but she is still reliant on the drug for her digestive system to work correctly. She says there was no availability to get the medication within her county, and she had to get her mother-in-law to make a two-hour journey to a pharmacy in Crewe. At one stage, she says she obtained the drug from another patient, who had a surplus, against regulations via Instagram. She describes her situation as constantly stressful. Leading pancreatic clinicians and charities including Pancreatic Cancer UK have written to the prime minister saying the absence of Pert can have a devastating impact on peoples lives, with doctors and pharmacists inundated with requests for help from desparate patients. The letter says that without the drug, people experience horrendous bowel symptoms, poor diabetes control, malnutrition, and reduced absorption of other medications, all of which can have a massive impact on their health and quality of life. There are other forms of Pert, but the charities and medical ex...",Health,feeds.bbci.co.uk,https://www.bbc.com/news/articles/cjry84d5jq5o,2025-03-08
Physician associate role is 'misleading' - coroner,"A coroner has said the public is being misled over what an NHS physician associate (PA) does after a woman died following hospital failings, including being misdiagnosed with a nosebleed. Pamela Marking went to AE at East Surrey Hospital in February 2024 after vomiting blood and having tenderness in her side. She was told by a PA she had a nosebleed and was sent home, but the 77-year-old actually had a hernia and died four days later following complications with her care after being readmitted to hospital. A Surrey and Sussex Healthcare NHS Trust spokesperson said it would look carefully at the coroners report to learn lessons on improving services and delivering the safest possible care. Our deepest sympathies remain with Ms Markings family and loved ones at this very difficult time, they added. We wish to express our profound regret for their loss. An NHS spokesperson said the NHS has always been clear that physician associates are not replacements for doctors and should only practice with appropriate medical supervision. But there remain legitimate concerns about the roles, they added. The coroners prevention of future deaths report, sent to the Department of Health and Social Care and NHS England, said the PA did not understand the significance of Ms Markings symptoms and had not examined her fully. Dr Karen Henderson, assistant coroner for Surrey, called the term physician associate misleading and said there was a lack of public knowledge that they were not medically qualified. PAs are graduates - usually with a health or life sciences degree - who have undertaken two years of postgraduate training. The NHS said they work under the supervision of a doctor and can diagnose people, take medical histories, perform physical examinations, see patients with long-term conditions, analyse test results and develop management plans. This blurring of roles without public knowledge... has the potential to devalue and undermine public confidence in the medical profession, said Dr Henderson. She added it could also compromise patient safety with PAs potentially undertaking roles outside their competency. The Department of Health and Social Care said it had launched an independent review into physician associates to establish the facts and make sure that we get the right people in the right places providing the right care. Follow BBC Surrey on Facebook or X. Send your story ideas to southeasttodaybbc.co.uk or WhatsApp us on 08081 002250.",Health,feeds.bbci.co.uk,https://www.bbc.com/news/articles/c80yydvn52mo,2025-03-08
Health chiefs warn of potential second norovirus wave,"People who have already had norovirus, the winter vomiting bug, could be at risk of catching it again this season, experts from the the UKs Health Security Agency say. Data shows a different strain of the virus is on the rise and having had one strain doesnt necessarily protect you from catching another, they advise. Norovirus can be particularly severe for young children, older adults and people with weakened immune systems. Cases are currently still exceptionally high with numbers at more than double the five-season-average for this time of year, latest figure show. Amy Douglas, Lead Epidemiologist at the UKHSA, said the biggest impact was being seen in hospitals and care homes. With multiple genotypes spreading at the same time, people could end up getting infected more than once this season, she added. Cases have been higher than expected partly because of the emergence of a recent strain of the virus called GII.17, but also because of improved ways of testing for the virus. Data now shows that a different, but more commonly seen strain, is on the rise. This means people who have already had the bug could catch it again as having one version of the virus does not fully protect you against the other. There is no suggestion that either strain leads to more severe illness than expected, however. Norovirus cases usually starts to decline as the weather warms up, but the UKHSA says it is too soon to work out whether cases have peaked. The total remains close to its record high, with an average of 1,134 patients a day in hospital with norovirus last week  down slightly on the previous week (1,160), but still nearly two and a half times that seen in the same period last year. Symptoms of norovirus include: If you think you may have norovirus, experts advise: Many household disinfectants do not work well against the virus. Nor do alcohol hand gels. If you are concerned - for example if a young child is not able to keep fluids down or the illness does not stop after a few days - make sure you seek medical advice Do not visit hospitals and care homes or prepare food for others, until 48 hours after symptoms have stopped.",Health,feeds.bbci.co.uk,https://www.bbc.com/news/articles/cqlyy2e5w4vo,2025-03-08
Michelle Mone-linked PPE firm evidence to be heard in private,"The chair of the Covid inquiry has ruled that evidence related to PPE Medpro, the firm linked to Baroness Michelle Mone and her husband Doug Barrowman, will be heard in a closed, private session next month. On 3 March, the inquiry will begin four weeks of hearings into decisions to buy Personal Protective Equipment (PPE) during the pandemic. Baroness Hallett said she was imposing the restriction as she was satisfied there was a risk of prejudice to criminal proceedings if sensitive evidence was heard in public. Victims groups and media outlets, including the BBC, had argued the dangers were overstated, given the early stage of the police investigation and the material already in the public domain. The National Crime Agency (NCA) opened an investigation into PPE Medpro in May 2021 into suspected criminal offences committed in the procurement of PPE. The company was awarded government contracts worth more than 200m after Baroness Mone recommended the firm to ministers during the Covid pandemic. Baroness Mone, 52, and Mr Barrowman, 59, have denied wrongdoing. In June 2024, the NCA said an unnamed 46-year-old man from Barnet, north London, had been arrested as part of its investigation. To date, no criminal charges have been brought and the Crown Prosecution Service has not been formally instructed by the NCA. On 9 December 2024, the Covid inquiry said it had received an application from the NCA for a restriction order, claiming there was a risk of harm to its investigation if sensitive evidence about PPE Medpro was heard in public. The NCA originally wanted to prevent the inquiry hearing any evidence about the company, saying other contracts could be selected. It then asked for 26 witness statements written by its staff to be withheld, and an order to be made preventing certain questions about the firm to be asked in the inquiry room in a public session. It argued those restrictions should include the identity of any person under investigation; evidence relating to the opinion of any government official concerning PPE Medpros contracts; and evidence about payments to the company and who ultimately benefited. In its submission, it said there was a realistic possibility that criminal charges against one or more individuals will flow from the investigation. The Department of Health later asked for the terms of any restriction order to be widened to include any financial material and correspondence relating to the purchase of PPE from the company, although that request has been rejected by the inquiry. In her final ruling, Baroness Hallett said it was both necessary and proportionate for the Covid inquiry to examine contracts between the government and PPE Medpro. But she did accept there was a risk of damage to any future criminal proceedings if she allowed all the evidence to be heard in public. As a result, any sensitive evidence about the company will be heard in a private, closed hearing, expected to be held in late March. She said the NCAs origina...",Health,feeds.bbci.co.uk,https://www.bbc.com/news/articles/c8rkj8pv684o,2025-03-08
'I discovered my fat build-up condition after a Love Islander had it',"For years, Emma Griffiths was self-conscious about the fact her legs had grown out of proportion with the rest of her body. But it wasnt until she was watching Love Island one night that the nurse noticed contestant Shaughna Phillips had the same shape legs - and started doing some research. Experts online suggested Shaughna had lipoedema and amateur triathlete Emma then knew this is what I had, Im not just obese. The 35-year-old mother has now joined calls for more support to be available on the NHS for people with lipoedema. Lipoedema causes fat to abnormally build-up mainly in the hips, buttocks and legs, leading to a disproportionate shape. The exact cause of the chronic condition is unknown but it is not from being overweight. Lipoedema may be caused by changes in hormones and is believed to affect about one in 10 people worldwide - although many do not know they have it. Emma was about 11 when her legs started to feel heavy and throb and said they started to grow bigger. I was looking in the mirror and thinking theres something wrong here, why are my legs different to girls my age?, she recalled. Despite leading a healthy lifestyle and at one point losing five stone, Emmas bottom half remained bigger and she suspected something was wrong. I thought this is not responding to diet and exercise - something is going on here, said the mum-of-two from Ammanford in Carmarthenshire. If I hadnt had seen Shaughna Phillips on Love Island, I dont think I would have known that I had lipoedema... or at that point, had the diagnosis. I went to see the GP and he didnt know what I was talking about. Despite having some NHS support, Emma asked to be referred to a lymphoedema clinic and a private surgeon diagnosed her with stage two lipoedema in 2022. Liposuction surgery removed four litres of fat from her thighs and while Emma said it helped, she said it did not cure her condition. She now manages it through a healthy lifestyle, wearing compression stockings and dry brushing her skin. She says that helps with swelling and pain relief. Gemma Robinson has also struggled with lipoedema and before her surgery, her legs were estimated to weigh about 11 stone (70kg). The 45-year-old has spent almost 70k on eight surgeries over two years to have 86 litres of fat and excess skin removed. Every time I was going back to the clinic my legs were growing, said the mother-of-two from Cardiff. Gemma said at one point she was almost housebound and could only get around through the help of a pushchair or shopping trolley. Despite losing nine and a half stone, she said it was mainly from her top half. My mobility was decreasing and I was going to end up in a wheelchair with my children pushing me, she said. Gemma spent years going back and forth to her GP where she claims her symptoms were brushed off and put down to obesity, until she saw something on TV and asked for a referral. A doctor said to me if I gave you a lettuce leaf for every meal for the rest of your life, you w...",Health,feeds.bbci.co.uk,https://www.bbc.com/news/articles/cp838j9jxlxo,2025-03-08
Blumenthal: 'I thought the TV was talking to me',"TV chef and restaurateur Heston Blumenthal said being sectioned was the best thing to have happened as he opened up about his bipolar symptoms. The 58-year-old, who was diagnosed with the condition in 2023 after being admitted to hospital, told BBC Breakfast how he once hallucinated a gun on the table. This wasnt all the time, but it was getting greater and greater, and being sectioned was the best thing that could happen to me, he said. Blumenthal, who runs several award-winning restaurants, including the three Michelin starred The Fat Duck in Bray, Berkshire, has now become an official ambassador for Bipolar UK. According to the charity, the mental health condition is an episodic disorder characterised by sometimes extreme changes in mood and energy which has the highest risk of suicide of any mental health condition. I laughed out loud after receiving a message from a woman who told me that during a manic episode she thought the TV was talking to her, Blumenthal, who also has ADHD, said. The reason I laughed out loud was because I experienced the same thing. The chef said it was really difficult for his wife, French businesswoman Melanie Ceysson, who he married in 2023. She had to decide how I would take it being sectioned and ... my response was, I embraced it, but I never thought I was going to be diagnosed as being bipolar, I thought at the time, the highs and the lows were normal, but they werent. And they werent right for me, and they werent right for the people around me that ... cared for me. The NHS says a person can be detained, also known as sectioning, under the Mental Health Act and can be treated without their agreement if they need urgent treatment for a mental health disorder and are at risk of harm to themselves or others. Famous for his experimental dishes such as snail porridge and bacon and egg ice cream, Blumenthal said medication initially dulled his culinary imagination. I was zombified - I had no energy at all. As my medications have been changed and my levels of self-confidence and self-awareness have gone up I realise my imagination and creativity is still there, he said. It was at levels that were so extreme before... looking back I can remember during my manic highs I was interrupting myself with ideas. He said someone recently asked him if there was a button I could press to turn off my bipolar - would I press it?, to which he replied, no, I wouldnt, because its part of me. He has since returned to the kitchen and said he was thinking more clearly. Bipolar UK estimates more than one million adults in the UK have the disorder, about 30 more than the number of people with dementia. But it is estimated at least 500,000 people are undiagnosed. Its an honour to have Heston onboard as an ambassador, Simon Kitchen, chief executive of Bipolar UK, said. We hope that his experience will encourage more people to seek help if they are struggling with their own diagnosis or are in the process of seeking one. You can follow BBC B...",Health,feeds.bbci.co.uk,https://www.bbc.com/news/articles/clyzz7qq1kpo,2025-03-08
